태그,질문,기술 분야,기술 키워드,세부 기술 키워드
,프로그레시브 렌더링(Progressive Rendering)이 무엇인지 설명해 주세요.,FE,Basic,검토필요
,다국어 페이지를 제공하는 방법에 대해 설명해 주세요.,FE,Basic,검토필요
,SEO(Search Engine Optimization)가 무엇인지 설명해 주세요.,FE,SEO,
,<section>과 <article> 태그의 차이에 대해 설명해 주세요.,FE,Basic,
,HTML5에서 도입된 주요 태그들에 대해 설명해 주세요.,FE,Basic,
,시맨틱 태그(Semantic Tag)가 무엇인지 설명해 주세요.,FE,Basic,
CSS,class와 id의 차이점을 설명해 주세요.,FE,CSS,
,CSS에서 float 속성이 어떻게 동작하는지 설명해 주세요.,FE,CSS,
,CSS에서 클리어링(Clearing)을 위한 다양한 방법과 각각을 언제 사용하는지 설명해 주세요.,FE,CSS,
,CSS에서 padding과 margin의 차이점에 대해 설명해 주세요.,FE,CSS,
,CSS 전처리기의 장점과 단점은 무엇인가요?,FE,CSS,
,페이지에서 표준 폰트가 아닌 폰트 디자인을 사용할 때 어떤 방식으로 처리하는지 설명해 주세요.,FE,CSS,
,CSS selector가 어떠한 원리로 동작하나요?,FE,CSS,
,"box model이 무엇이며, 브라우저에서 어떻게 동작하는지 설명해 주세요",FE,CSS,
,display 속성에 어떤 것들이 있는지 설명해 주세요.,FE,CSS,
,"요소를 배치하는 방법(static, relative, fixed, absolute) 간의 차이는 무엇인가요?",FE,CSS,
,CSS 애니메이션과 JS 애니메이션의 차이에 대해서 설명해 주세요.,FE,CSS,
,flex를 사용하는 이유가 무엇인가요?,FE,CSS,
javscript,"이벤트 버블링(Event Bubbling), 이벤트 캡쳐링(Event Capturing)에 대해서 설명하세요.",FE,JavaScript,
,이벤트 위임(Event Delegation)에 대해 설명해 주세요.,FE,JavaScript,
,this는 JavaScript에서 어떻게 작동하는지 설명해주세요.,FE,JavaScript,
,JavaScript에서 프로토타입 기반 상속(Prototype-based Inheritance)을 사용하는 방법에 대해 설명해 주세요.,FE,JavaScript,
,null과 undefined의 차이점은 무엇인가요?,FE,JavaScript,
,익명함수(anonymous functions)는 주로 어떤 상황에서 사용하나요?,FE,JavaScript,
,AJAX(Asynchronous JavaScript and XML)에 대해 가능한 한 자세히 설명해 주세요.,FE,JavaScript,
,호이스팅(Hoisting)에 대해서 설명하세요.,FE,JavaScript,
,"use strict가 무엇인지, 그리고 사용했을 때의 장단점에 대해 설명해 주세요.",FE,JavaScript,
,"Callback과 Promise, async/await의 차이점에 대해서 설명해 주세요.",FE,JavaScript,
,"클로저(Closure)가 무엇인지, 어떻게 사용하는지, 그리고 왜 사용하는지 설명해 주세요.",FE,JavaScript,
,"let, var, const의 차이점에 관해서 설명해 주세요.",FE,JavaScript,
,모듈 패턴(Module Pattern)과 전통적 상속(Traditional Inheritance)의 장단점을 설명해 주세요.,FE,ECMAScript,
,event loop란 무엇인가요?,FE,JavaScript,
,호스트 객체(Host Objects)와 네이티브 객체(Native Objects)의 차이점은 무엇인가요?,FE,JavaScript,
,"JSON(JavaScript Object Notation)이 무엇인지, 그리고 사용했을 때의 장점이 무엇인지 설명해 주세요.",FE,JavaScript,
,전역 스코프(Global Scope)를 사용했을 때의 장단점에 대해 설명해 주세요.,FE,JavaScript,
,function foo() {}와 var foo = function() {}에서 foo 의 차이가 무엇인지 설명해보세요.,FE,JavaScript,
,JavaScript의 작동방식의 장단점에 관해 설명해주세요.,FE,JavaScript,
,함수형 프로그래밍에 대해 설명해 주세요.,FE,JavaScript,
,Callback을 왜 사용하는지 설명해 주세요.,FE,JavaScript,
,ES6에서 바뀐 문법을 생각나는 대로 이야기해 주세요.,FE,ECMAScript,
,ES6 이상의 버전을 브라우저에서 인식하지 못할 때 어떻게 해결할 수 있는지 설명해 주세요.,FE,ECMAScript,
,"JavaScript 메서드인 .call(), .apply(), .bind()의 차이에 대해 설명해 주세요.",FE,JavaScript,
,ES6에서 화살표 함수와 일반 함수의 차이에 대해 설명해 주세요.,FE,JavaScript,
자료구조,Array와 LinkedList의 차이가 무엇인가요?,"BE, FE",Data Structure,
,Stack과 Queue의 차이점은 무엇인가요?,"BE, FE",Data Structure,
,BST와 Binary Tree에 대해서 설명하세요.,"BE, FE",Data Structure,
,PriorityQueue의 동작 원리가 어떻게 되나요?,"BE, FE",Data Structure,
,해시테이블(HashTable)에 대해서 설명해주세요.,"BE, FE",Data Structure,
,최소 스패닝 트리(Minimum Spanning Tree)에 대해서 설명해주세요.,"BE, FE",Data Structure,
운영체제,컴파일러와 인터프리터의 차이가 무엇인가요?,"BE, FE",OS,
,프로세스와 스레드의 차이가 무엇인가요?,"BE, FE",OS,
,LRU(Least Recently Used)에 대해 설명해 주세요.,"BE, FE",OS,
,Thread-safe의 개념이 무엇인지 설명해 주세요.,"BE, FE",OS,
,GPU(Graphics Processing Unit)와 CPU(Central Processing Unit)의 차이에 대해 설명해 주세요.,"BE, FE",OS,
,"교착상태(Deadlock)가 무엇인지, 그리고 발생하는 조건에 대해 설명해 주세요.","BE, FE",OS,
,문맥 전환(Context Switching)이 무엇인가요?,"BE, FE",OS,
,페이지 폴트(Page Fault)가 무엇인지 설명해 주세요.,"BE, FE",OS,
,메모리가 어떻게 구성되어 있는지 설명해 주세요.,"BE, FE",OS,
,가상 메모리(Virtual Memory)에 대해 설명해 주세요.,"BE, FE",OS,
,브라우저 렌더링 과정에 대해 상세하게 설명해 주세요.,"BE, FE",OS,
,HTTP와 HTTPS 통신 방식의 차이에 대해 설명해 주실 수 있나요?,"BE, FE",http,
,"OOP(Object-Oriented Programming)의 특징(상속, 캡슐화 등)에 대해 설명해 주실 수 있나요?","BE, FE",OOP,
,함수형 프로그래밍에 대해 설명해 주실 수 있나요?,"BE, FE",Basic,
,함수형 프로그래밍의 개념에서 순수 함수란 무엇인가요?,"BE, FE",Basic,
,OOP와 함수형 프로그래밍의 가장 큰 차이점은 무엇인가요?,"BE, FE",Basic,
웹 프로토콜,웹 프로토콜이란?,"BE, FE",Basic,
,HTTP 통신이란 무엇인가요?,"BE, FE",http,
,HTTP 1.1과 2.0의 차이는 무엇인가요?,"BE, FE",http,
,AJAX란 무엇인가요?,"BE, FE",AJAX,
,Promise와 Callback의 차이점 및 각각의 장단점에 대해 설명해 주실 수 있나요?,FE,JavaScript,
,"Promise란 무엇이며, 그 코드가 어떻게 구성되어 있는지 설명해 주실 수 있나요?",FE,JavaScript,
,Async와 Await가 무엇인지 설명해 주실 수 있나요? 그리고 사용해본 경험이 있나요?,FE,JavaScript,
,"Async, Await와 Promise의 차이점은 무엇인가요?",FE,JavaScript,
,"자바스크립트의 Number Type은 다른 언어들과 차이점이 무엇인가, 왜 하나만 존재하나.",FE,JavaScript,
,"자바스크립트의 원시 타입은 몇 가지이며, 그 종류는 무엇인가요?",FE,JavaScript,
,실행 컨텍스트(Execution Context)에 대해 설명해주세요.,FE,JavaScript,
,"클로저(Closure)란 무엇이며, 왜 이러한 패턴을 사용하는지 설명해 주실 수 있나요?",FE,JavaScript,
,자바스크립트에서 호이스팅(Hoisting)이 어떻게 이루어지는지 설명해 주실 수 있나요?,FE,JavaScript,
,가비지 컬렉터의 역할과 동작 방식에 대해 설명해 주실 수 있나요?,"BE, FE",GC,
,자바스크립트의 순환참조란? 어떤게 문제이고 해결방법은?,FE,JavaScript,
,자바스크립트의 배열이 실제 자료구조 배열이 아닌 이유는 무엇인가요?,FE,JavaScript,
,이벤트 루프와 자바스크립트의 동시성 모델에 대해 설명해 주실 수 있나요?,FE,JavaScript,
,프로토타입이란 무엇인가요?,FE,JavaScript,
,자바스크립트에서 `this`는 몇 가지로 추론될 수 있나요?,FE,JavaScript,
,일반 함수의 `this`와 화살표 함수의 `this`는 어떻게 다른가요?,FE,JavaScript,
,"`call`, `apply`, `bind` 함수에 대해 설명해 주실 수 있나요?",FE,JavaScript,
,`use strict` 모드에서의 `this`가 어떻게 동작하는지 설명해 주실 수 있나요?,FE,JavaScript,
,ES6 스펙을 완벽히 지원하지 않는 브라우저에서 ES6 코드를 실행하기 위한 해결 방법은 무엇인가요?,FE,ECMAScript,
,"Babel이란 무엇이며, Babel은 컴파일러인가요, 아니면 트랜스파일러인가요?",FE,bundler,
,ES6(ECMAScript 2015)에서 추가된 스펙에 대해 알고 있는 것을 모두 설명해 주실 수 있나요?,FE,ECMAScript,
,"`var`, `let`, `const`의 차이점을 function scope와 block scope의 개념에서 설명해 주실 수 있나요?",FE,JavaScript,
,"Class가 무엇인지 설명해 주시고, Prototype과 function을 사용한 ES5 스펙만으로 Class를 구현할 수 있는지 설명해 주실 수 있나요?",FE,ECMAScript,
,"React의 상태 관리에 대해 알고 있나요? Redux를 사용해 본 경험이 있다면, 그것에 대해 설명해 주실 수 있나요?",FE,Redux,
,Redux-saga와 Observable에 대해 들어본 적이 있나요?,FE,redux sage,
,Context API에 대해 설명해 주실 수 있나요?,FE,React,
,클래스형 컴포넌트와 함수형 컴포넌트의 차이는 무엇인가요?,FE,React,
,React의 라이프사이클 메서드에 대해 설명해 주실 수 있나요?,FE,React,
,"타입스크립트를 사용해 본 경험이 있나요? 또한, 타입스크립트에 대한 본인의 생각과 도입했을 때의 장점에 대해 설명해 주실 수 있나요?",FE,Typescript,
,Angular와 React의 차이점에 대해 설명해 주실 수 있나요?,FE,Angular,
,Angular와 React의 차이점에 대해 설명해 주실 수 있나요?,FE,React,
,라이브러리와 프레임워크의 차이에 대해 설명해 주실 수 있나요?,"BE, FE",Basic,
,"두 명의 개발자가 협업할 때, Git을 관리하는 방식에 대해 설명해 주실 수 있나요?","BE, FE",git,
,"메서드 체이닝이란 무엇이며, 그 장단점에 대해 설명해 주실 수 있나요?","BE, FE",Design Pattern,
,메모라이제이션(Memoization)이란 무엇인지 설명해 주실 수 있나요?,"BE, FE",cache,
,RESTful API가 무엇인지 알고 있는 대로 설명해 주실 수 있나요?,"BE, FE",Basic,
,"CORS(Cross-Origin Resource Sharing)가 무엇인지, 왜 정의되었는지 설명해 주실 수 있나요? 또한, 코드를 작성하면서 CORS와 관련해 겪었던 이슈가 있다면 설명해 주실 수 있나요?","BE, FE",security,CORS
,ESLint가 무엇인지 설명해 주실 수 있나요?,FE,Basic,검토필요
,Prettier가 무엇인지 설명해 주실 수 있나요?,FE,Basic,검토필요
,Webpack이란 무엇인가요?,FE,bundler,
,어떤 패키지 매니저를 사용해보셨나요?,FE,bundler,
,npm과 Yarn의 차이점은 무엇인가요?,FE,bundler,
,"배포를 해본 적이 있나요? 있다면, 배포를 어떻게 진행했는지 설명해 주실 수 있나요?","BE, FE",Basic,
,적응형(Adaptive)과 반응형(Responsive) 디자인의 차이를 알고 있나요?,FE,UI/UX,
,`package.json` 파일의 역할은 무엇인가요?,FE,Basic,
,`package.json`에서 `dependencies`와 `devDependencies`의 차이는 무엇인가요?,FE,Basic,
,프로세스와 스레드의 차이는 무엇인가요?,"BE, FE",OS,
,CSR(Client-Side Rendering)과 SSR(Server-Side Rendering)의 차이는 무엇인가요?,FE,rendering,
,이벤트 위임이란 무엇인가요?,FE,JavaScript,
,DOM을 직접 건드리는 방식과 그렇지 않은 방식의 차이는 무엇인가요?,FE,Basic,
,반응형 프로그래밍이란 무엇인가요?,FE,UI/UX,
,Call by Value와 Call by Reference의 차이는 무엇인가요?,"BE, FE",Basic,
,`null`과 `undefined`의 차이는 무엇인가요?,FE,JavaScript,
,`inline`과 `inline-block`의 차이는 무엇인가요?,FE,JavaScript,
,Vue.js의 라이프사이클에 대해 설명해 주실 수 있나요?,FE,Vue.js,
,HTTP 통신 방식에 대해 설명해 주실 수 있나요?​,FE,http,
,Cookie와 Session의 차이는 무엇인가요?,"BE, FE",Cookie,
,Cookie와 Session의 차이는 무엇인가요?,"BE, FE",Session,
,MVC와 MVVM 디자인 패턴의 차이점과 각각의 특징에 대해 설명해 주실 수 있나요?,"BE, FE",Design Pattern,
,"Model, View, Controller의 차이는 무엇인가요?","BE, FE",Design Pattern,
,Forward와 Redirect의 차이는 무엇인가요?,"BE, FE",Design Pattern,
,Vue.js의 라이프사이클 함수에 대해 설명해 주실 수 있나요?,FE,Vue.js,
,동기와 비동기의 차이를 예시를 들어 설명해 주실 수 있나요?,"BE, FE",Basic,
,REST와 RESTful에 대해 설명해 주실 수 있나요?,"BE, FE",Basic,